{
  "task_id": "ENG-142",
  "task_class": "configuration_validation",
  "mode": "STRICT",
  "policy_version": "0.1.0-dev",
  "policy_hash": null,
  "model_provider": "example",
  "model_id": "example-model",
  "prompt_template_version": "1",
  "input_tokens": 1200,
  "output_tokens": 350,
  "input_context_bytes": 18000,
  "model_calls": 1,
  "tool_calls": 3,
  "redundant_tool_calls": 0,
  "cache_hits": 1,
  "retries": 0,
  "revisions": 0,
  "wall_clock_ms": 4200,
  "estimated_cost": null,
  "cost_currency": null,
  "context_escalations": [],
  "model_escalations": [],
  "validation_result": "PASS",
  "quality_score": null,
  "quality_evaluator": "deterministic_validation",
  "human_correction_required": false,
  "novel_candidates": null,
  "downstream_survivors": null,
  "completion_state": "COMPLETE"
}
